{"entries":[{"branch_boundary":false,"branch_id":0,"event":{"actor":"runtime","event_id":"evt-000001","event_type":"snapshot.published","payload":{"reason":"scenario_started","snapshot_id":"snp-000001"},"scenario_id":"trauma_splenic_01","schema_version":"1.1","simulation_time_s":0.0,"source":"vpe_core"},"sequence":1,"simulation_time_s":0.0,"snapshot":{"engine_version":"pulse/4.3.2+e8a3649","reason":"scenario_started","scenario_id":"trauma_splenic_01","simulation_time_s":0.0,"snapshot_id":"snp-000001","telemetry":{"blood_volume_ml":5488.938779434853,"heart_rate_bpm":71.9999999989269,"mean_arterial_pressure_mmhg":95.3234178279229,"oxygen_saturation":0.9741251041947515,"total_hemorrhaged_volume_ml":0.0}}},{"branch_boundary":false,"branch_id":0,"event":{"actor":"learner","event_id":"evt-000002","event_type":"clinical.intent.recorded","payload":{"command_id":"cmd-000001","intent_id":"PAIN_ONSET"},"scenario_id":"trauma_splenic_01","schema_version":"1.1","simulation_time_s":0.0,"source":"scenario_runtime"},"sequence":2,"simulation_time_s":0.0,"snapshot":null},{"branch_boundary":false,"branch_id":0,"event":{"actor":"learner","event_id":"evt-000003","event_type":"clinical.intent.recorded","payload":{"command_id":"cmd-000002","intent_id":"PAIN_LOCATION"},"scenario_id":"trauma_splenic_01","schema_version":"1.1","simulation_time_s":0.0,"source":"scenario_runtime"},"sequence":3,"simulation_time_s":0.0,"snapshot":null},{"branch_boundary":false,"branch_id":0,"event":{"actor":"learner","event_id":"evt-000004","event_type":"clinical.intent.recorded","payload":{"command_id":"cmd-000003","intent_id":"MECHANISM_OF_INJURY"},"scenario_id":"trauma_splenic_01","schema_version":"1.1","simulation_time_s":0.0,"source":"scenario_runtime"},"sequence":4,"simulation_time_s":0.0,"snapshot":null},{"branch_boundary":false,"branch_id":0,"event":{"actor":"learner","event_id":"evt-000005","event_type":"observation.requested","payload":{"command_id":"cmd-000004","observation_id":"VITALS"},"scenario_id":"trauma_splenic_01","schema_version":"1.1","simulation_time_s":0.0,"source":"scenario_runtime"},"sequence":5,"simulation_time_s":0.0,"snapshot":null},{"branch_boundary":false,"branch_id":0,"event":{"actor":"learner","event_id":"evt-000006","event_type":"clinical.hypothesis.recorded","payload":{"command_id":"cmd-000005","hypothesis_id":"INTERNAL_BLEEDING"},"scenario_id":"trauma_splenic_01","schema_version":"1.1","simulation_time_s":0.0,"source":"scenario_runtime"},"sequence":6,"simulation_time_s":0.0,"snapshot":null},{"branch_boundary":false,"branch_id":0,"event":{"actor":"learner","event_id":"evt-000007","event_type":"observation.requested","payload":{"command_id":"cmd-000006","observation_id":"FAST"},"scenario_id":"trauma_splenic_01","schema_version":"1.1","simulation_time_s":0.0,"source":"scenario_runtime"},"sequence":7,"simulation_time_s":0.0,"snapshot":null},{"branch_boundary":false,"branch_id":0,"event":{"actor":"runtime","event_id":"evt-000008","event_type":"clock.advanced","payload":{"command_id":"cmd-000007","duration_s":60.0},"scenario_id":"trauma_splenic_01","schema_version":"1.1","simulation_time_s":60.0,"source":"vpe_core"},"sequence":8,"simulation_time_s":60.0,"snapshot":null},{"branch_boundary":false,"branch_id":0,"event":{"actor":"runtime","event_id":"evt-000009","event_type":"snapshot.published","payload":{"reason":"time_advanced","snapshot_id":"snp-000002"},"scenario_id":"trauma_splenic_01","schema_version":"1.1","simulation_time_s":60.0,"source":"vpe_core"},"sequence":9,"simulation_time_s":60.0,"snapshot":{"engine_version":"pulse/4.3.2+e8a3649","reason":"time_advanced","scenario_id":"trauma_splenic_01","simulation_time_s":60.0,"snapshot_id":"snp-000002","telemetry":{"blood_volume_ml":5431.46934624677,"heart_rate_bpm":71.82694750123454,"mean_arterial_pressure_mmhg":95.26465017298027,"oxygen_saturation":0.9741390905820094,"total_hemorrhaged_volume_ml":59.98000000000378}}},{"branch_boundary":false,"branch_id":0,"event":{"actor":"learner","event_id":"evt-000010","event_type":"intervention.applied","payload":{"command_id":"cmd-000008","compound":"Saline","intervention_id":"crystalloid_saline","rate_ml_min":100.0,"volume_ml":500.0},"scenario_id":"trauma_splenic_01","schema_version":"1.1","simulation_time_s":60.0,"source":"physiology_adapter"},"sequence":10,"simulation_time_s":60.0,"snapshot":null},{"branch_boundary":false,"branch_id":0,"event":{"actor":"runtime","event_id":"evt-000011","event_type":"snapshot.published","payload":{"reason":"intervention_applied","snapshot_id":"snp-000003"},"scenario_id":"trauma_splenic_01","schema_version":"1.1","simulation_time_s":60.0,"source":"vpe_core"},"sequence":11,"simulation_time_s":60.0,"snapshot":{"engine_version":"pulse/4.3.2+e8a3649","reason":"intervention_applied","scenario_id":"trauma_splenic_01","simulation_time_s":60.0,"snapshot_id":"snp-000003","telemetry":{"blood_volume_ml":5431.46934624677,"heart_rate_bpm":71.82694750123454,"mean_arterial_pressure_mmhg":95.26465017298027,"oxygen_saturation":0.9741390905820094,"total_hemorrhaged_volume_ml":59.98000000000378}}},{"branch_boundary":false,"branch_id":0,"event":{"actor":"runtime","event_id":"evt-000012","event_type":"clock.advanced","payload":{"command_id":"cmd-000009","duration_s":60.0},"scenario_id":"trauma_splenic_01","schema_version":"1.1","simulation_time_s":120.0,"source":"vpe_core"},"sequence":12,"simulation_time_s":120.0,"snapshot":null},{"branch_boundary":false,"branch_id":0,"event":{"actor":"runtime","event_id":"evt-000013","event_type":"snapshot.published","payload":{"reason":"time_advanced","snapshot_id":"snp-000004"},"scenario_id":"trauma_splenic_01","schema_version":"1.1","simulation_time_s":120.0,"source":"vpe_core"},"sequence":13,"simulation_time_s":120.0,"snapshot":{"engine_version":"pulse/4.3.2+e8a3649","reason":"time_advanced","scenario_id":"trauma_splenic_01","simulation_time_s":120.0,"snapshot_id":"snp-000004","telemetry":{"blood_volume_ml":5474.044403823547,"heart_rate_bpm":70.52982501852759,"mean_arterial_pressure_mmhg":94.58982416030136,"oxygen_saturation":0.9744805717647648,"total_hemorrhaged_volume_ml":119.97999999999327}}},{"branch_boundary":false,"branch_id":0,"event":{"actor":"learner","event_id":"evt-000014","event_type":"observation.requested","payload":{"command_id":"cmd-000010","observation_id":"VITALS"},"scenario_id":"trauma_splenic_01","schema_version":"1.1","simulation_time_s":120.0,"source":"scenario_runtime"},"sequence":14,"simulation_time_s":120.0,"snapshot":null},{"branch_boundary":false,"branch_id":0,"event":{"actor":"learner","event_id":"evt-000015","event_type":"escalation.recorded","payload":{"command_id":"cmd-000011","escalation_id":"trauma_team_escalation"},"scenario_id":"trauma_splenic_01","schema_version":"1.1","simulation_time_s":120.0,"source":"scenario_runtime"},"sequence":15,"simulation_time_s":120.0,"snapshot":null}],"scenario_id":"trauma_splenic_01","schema_version":"1.0","time_axis":"simulation_time_s"}
